{
  "post_text": "The Arctic ocean photographed in the same place, 107 years ago vs today. https://t.co/0usPdWajtY",
  "image_url": "media_factually_correct_class/photo_97_0.jpg",
  "structured_response": {
    "image_description": "The image is a side-by-side comparison of two photographs. The top photograph depicts a person in a small boat navigating near a large, rugged glacier. The water appears calm, and the glacier dominates the background. The bottom photograph shows a similar scene but with a modern motorized inflatable boat, and the glacier in the background is visibly smaller and less prominent. The sky in the bottom photo is partly cloudy, and the overall color palette is brighter and more vivid.",
    "ocr_text": "",
    "manipulation_signs": "The two photographs appear to be genuine photographs, not AI-generated or heavily edited. The lighting, shadows, and details in both images are consistent with natural photography. There are no signs of distortion, unnatural shadows, or inconsistent reflections.",
    "named_entities": [
      "The image includes a glacier",
      "a body of water",
      "a small boat in the top photo and a motorized inflatable boat in the bottom photo",
      "and a mountainous landscape in the background. The text \"HOLMEN\" is visible on the inflatable boat in the bottom photo"
    ],
    "five_ws": {
      "who": "A person is in the boat in both photographs",
      "what": "The person is navigating near a glacier",
      "where": "Near glaciers, likely in the Arctic region",
      "when": "The top photo appears to be historical, and the bottom photo is more recent",
      "why": "The post implies a comparison of the glacier's size over time, suggesting climate change"
    },
    "image_text_alignment": "The image visually supports the claim made in the text by showing a comparison of the glacier's size between the past and the present.",
    "emotive_or_fallacious_language": "The post does not contain emotionally charged language or logical fallacies.",
    "timestamp_consistency": "The post mentions \"107 years ago,\" implying the top photo is historical. The bottom photo is clearly more recent, as evidenced by the modern boat and the different appearance of the glacier. This is consistent with the historical reference."
  },
  "raw_response": "- **Image Description**: The image is a side-by-side comparison of two photographs. The top photograph depicts a person in a small boat navigating near a large, rugged glacier. The water appears calm, and the glacier dominates the background. The bottom photograph shows a similar scene but with a modern motorized inflatable boat, and the glacier in the background is visibly smaller and less prominent. The sky in the bottom photo is partly cloudy, and the overall color palette is brighter and more vivid.\n  \n- **OCR**: No visible text.\n\n- **Manipulation Signs**: The two photographs appear to be genuine photographs, not AI-generated or heavily edited. The lighting, shadows, and details in both images are consistent with natural photography. There are no signs of distortion, unnatural shadows, or inconsistent reflections.\n\n- **Named Entities**: The image includes a glacier, a body of water, a small boat in the top photo and a motorized inflatable boat in the bottom photo, and a mountainous landscape in the background. The text \"HOLMEN\" is visible on the inflatable boat in the bottom photo.\n\n- **5Ws Extraction**:\n  - **Who is involved?**: A person is in the boat in both photographs.\n  - **What is happening?**: The person is navigating near a glacier.\n  - **Where is this taking place?**: Near glaciers, likely in the Arctic region.\n  - **When is it happening (explicit or implied)?**: The top photo appears to be historical, and the bottom photo is more recent.\n  - **Why is this happening (if stated)?**: The post implies a comparison of the glacier's size over time, suggesting climate change.\n\n- **Image-Text Alignment**: The image visually supports the claim made in the text by showing a comparison of the glacier's size between the past and the present.\n\n- **Emotive Language or Logical Fallacies**: The post does not contain emotionally charged language or logical fallacies.\n\n- **Timestamp Consistency Check**: The post mentions \"107 years ago,\" implying the top photo is historical. The bottom photo is clearly more recent, as evidenced by the modern boat and the different appearance of the glacier. This is consistent with the historical reference."
}