{
  "post_text": "The number of years each region was part of the Roman Empire. https://t.co/tZqg0ORyh5",
  "image_url": "media_factually_correct_class/photo_796_0.jpg",
  "structured_response": {
    "image_description": "The image is a map depicting regions of Europe and the Middle East, shaded in varying intensities of purple and pink to indicate the duration of Roman Empire influence. Numbers are overlaid on the map indicating years, presumably representing the years each region was under Roman influence.",
    "ocr_text": "The text visible in the image includes numbers indicating years, such as \"50\", \"100\", \"150\", \"200\", etc., spread across different regions of the map. There is no visible heading or title.",
    "manipulation_signs": "The map appears to be a standard representation of historical data. There are no signs of distortion, unnatural shadows, inconsistent lighting, or blurry objects that would suggest manipulation. The map looks realistic and free of obvious manipulation.",
    "named_entities": [
      "The named entities include regions of Europe and the Middle East",
      "and the years \"50\"",
      "\"100\"",
      "\"150\"",
      "\"200\"",
      "etc",
      "which represent durations"
    ],
    "five_ws": {
      "who": "The Roman Empire",
      "what": "The map illustrates the duration of Roman Empire influence in different regions",
      "where": "Europe and the Middle East",
      "when": "The years indicated on the map, ranging from \"50\" to \"1400\"",
      "why": "The map is likely a representation of historical data on the extent and duration of Roman Empire dominance"
    },
    "image_text_alignment": "The image visually matches the claim made in the post text, as it shows the regions and their durations under Roman influence.",
    "emotive_or_fallacious_language": "The post text does not contain emotionally charged language or logical fallacies.",
    "timestamp_consistency": "The post text mentions a date of \"13 March 2024\", which is in the past. The image, which represents historical data, is consistent with this timeframe."
  },
  "raw_response": "- **Image Description**: The image is a map depicting regions of Europe and the Middle East, shaded in varying intensities of purple and pink to indicate the duration of Roman Empire influence. Numbers are overlaid on the map indicating years, presumably representing the years each region was under Roman influence.\n- **OCR**: The text visible in the image includes numbers indicating years, such as \"50\", \"100\", \"150\", \"200\", etc., spread across different regions of the map. There is no visible heading or title.\n- **Manipulation Signs**: The map appears to be a standard representation of historical data. There are no signs of distortion, unnatural shadows, inconsistent lighting, or blurry objects that would suggest manipulation. The map looks realistic and free of obvious manipulation.\n- **Named Entities**: The named entities include regions of Europe and the Middle East, and the years \"50\", \"100\", \"150\", \"200\", etc., which represent durations.\n- **5Ws Extraction**:\n  - **Who is involved?**: The Roman Empire.\n  - **What is happening?**: The map illustrates the duration of Roman Empire influence in different regions.\n  - **Where is this taking place?**: Europe and the Middle East.\n  - **When is it happening (explicit or implied)?**: The years indicated on the map, ranging from \"50\" to \"1400\".\n  - **Why is this happening (if stated)?**: The map is likely a representation of historical data on the extent and duration of Roman Empire dominance.\n- **Image-Text Alignment**: The image visually matches the claim made in the post text, as it shows the regions and their durations under Roman influence.\n- **Emotive Language or Logical Fallacies**: The post text does not contain emotionally charged language or logical fallacies.\n- **Timestamp Consistency Check**: The post text mentions a date of \"13 March 2024\", which is in the past. The image, which represents historical data, is consistent with this timeframe."
}