{
  "post_text": "Sinon, Macron s'est fait un petit aller-retour en Falcon pour aller skier ce week-end dans les Pyrénées. \n\nTranquille. \n\n\"Le président de la République a profité des dernières chutes de neige et d’une fenêtre météo favorable pour venir skier à La Mongie ce samedi 2 mars.\" - https://t.co/jNPdPZhsux",
  "image_url": "media_factually_correct_class/photo_1260_0.jpg",
  "structured_response": {
    "image_description": "The image shows two individuals seated on a ski lift, both wearing winter clothing and ski boots. They appear to be engaged in a close, affectionate gesture, leaning towards each other. The background suggests a snowy, mountainous environment, typical of a ski resort.",
    "ocr_text": "",
    "manipulation_signs": "The individuals' faces appear slightly unnatural, with exaggerated features, which might suggest AI-generated or heavily edited content. The shadows and lighting are consistent, but the faces seem overly smooth and stylized.",
    "named_entities": [
      "- Macron (presumably Emmanuel Macron",
      "the President of France)\n  - La Mongie (a ski resort in the Pyrénées)\n  - No other specific entities are clearly identifiable"
    ],
    "five_ws": {
      "who": "Macron and a companion",
      "what": "They are sitting on a ski lift, wearing ski gear, and appear to be kissing or leaning closely together",
      "where": "La Mongie, in the Pyrénées",
      "when": "March 2, 2024, as referenced in the linked article",
      "why": "The linked article mentions Macron visiting La Mongie to ski due to favorable weather and recent snowfall"
    },
    "image_text_alignment": "The image depicts a scene that aligns with the claim that Macron went skiing at La Mongie. However, the image does not explicitly confirm the identity of the individuals or the exact date as mentioned in the linked article.",
    "emotive_or_fallacious_language": "The text uses emotionally charged language (\"Tranquille.\") but does not contain any logical fallacies.",
    "timestamp_consistency": "The post text mentions March 2, 2024, which is consistent with the date referenced in the linked article. The image does not contradict this date."
  },
  "raw_response": "- **Image Description**: The image shows two individuals seated on a ski lift, both wearing winter clothing and ski boots. They appear to be engaged in a close, affectionate gesture, leaning towards each other. The background suggests a snowy, mountainous environment, typical of a ski resort.\n  \n- **OCR**: No visible text.\n\n- **Manipulation Signs**: The individuals' faces appear slightly unnatural, with exaggerated features, which might suggest AI-generated or heavily edited content. The shadows and lighting are consistent, but the faces seem overly smooth and stylized.\n\n- **Named Entities**: \n  - Macron (presumably Emmanuel Macron, the President of France)\n  - La Mongie (a ski resort in the Pyrénées)\n  - No other specific entities are clearly identifiable.\n\n- **5Ws Extraction**:\n  - **Who is involved?**: Macron and a companion.\n  - **What is happening?**: They are sitting on a ski lift, wearing ski gear, and appear to be kissing or leaning closely together.\n  - **Where is this taking place?**: La Mongie, in the Pyrénées.\n  - **When is it happening (explicit or implied)?**: March 2, 2024, as referenced in the linked article.\n  - **Why is this happening (if stated)?**: The linked article mentions Macron visiting La Mongie to ski due to favorable weather and recent snowfall.\n\n- **Image-Text Alignment**: The image depicts a scene that aligns with the claim that Macron went skiing at La Mongie. However, the image does not explicitly confirm the identity of the individuals or the exact date as mentioned in the linked article.\n\n- **Emotive Language or Logical Fallacies**: The text uses emotionally charged language (\"Tranquille.\") but does not contain any logical fallacies.\n\n- **Timestamp Consistency Check**: The post text mentions March 2, 2024, which is consistent with the date referenced in the linked article. The image does not contradict this date.\n\n- **Conclusion**: The image appears to be manipulated, as the faces are unnatural and stylized, which could indicate AI-generated or heavily edited content. The image does visually match the claim that Macron went skiing, but the manipulation raises doubts about the authenticity of the image."
}