{
  "post_text": "Why is this allowed, with our pathetic 2tier Police looking on and doing fuck all. Yet they arrest a white woman for silently praying outside an abortion clinic, an absolute joke. https://t.co/fA9ZVK2QbV",
  "image_url": "media_manipulated_class/photo_2975_0.jpg",
  "structured_response": {
    "image_description": "The image shows a group of individuals dressed in full-body coverings, including headscarves and hoods, kneeling in a street. They are surrounded by police officers in high-visibility jackets and helmets. The setting appears to be a city street with classic architecture, shops, and a double-decker bus labeled \"Procsime 19\" in the background. Flags are hanging above the street.",
    "ocr_text": "",
    "manipulation_signs": "The individuals in the image appear to be kneeling uniformly, which could indicate AI-generated or manipulated content. The shadows and lighting are consistent, but the uniformity of the poses may suggest digital manipulation.",
    "named_entities": [
      "Individuals",
      "police officers",
      "shops",
      "\"Procsime 19\" bus",
      "flags"
    ],
    "five_ws": {
      "who": "Individuals in full-body coverings, police officers",
      "what": "Individuals are kneeling, and police officers are observing",
      "where": "A city street with shops and a bus",
      "when": "The image does not provide an explicit timeframe, but the clothing and bus style imply a recent event",
      "why": "The post text implies criticism of the police response to a protest, referencing a white woman being arrested for praying outside an abortion clinic"
    },
    "image_text_alignment": "The kneeling individuals and police presence in the image do not directly align with the specific claim about a white woman being arrested for praying outside an abortion clinic. The image appears to depict a protest or demonstration, not a specific arrest.",
    "emotive_or_fallacious_language": "The post text uses emotionally charged language (\"pathetic,\" \"fuck all,\" \"absolute joke\") and suggests a logical fallacy by implying a connection between the kneeling protesters and the arrest of a white woman, which is not substantiated by the image.",
    "timestamp_consistency": "The post is dated January 20, 2024, and the image appears to depict a recent protest. However, the image does not provide a specific date, and the protest could be from a recent event or a staged protest."
  },
  "raw_response": "- **Image Description**: The image shows a group of individuals dressed in full-body coverings, including headscarves and hoods, kneeling in a street. They are surrounded by police officers in high-visibility jackets and helmets. The setting appears to be a city street with classic architecture, shops, and a double-decker bus labeled \"Procsime 19\" in the background. Flags are hanging above the street.\n  \n- **OCR**: No visible text.\n  \n- **Manipulation Signs**: The individuals in the image appear to be kneeling uniformly, which could indicate AI-generated or manipulated content. The shadows and lighting are consistent, but the uniformity of the poses may suggest digital manipulation.\n  \n- **Named Entities**: Individuals, police officers, shops, \"Procsime 19\" bus, flags.\n  \n- **5Ws Extraction**:\n  - **Who is involved?**: Individuals in full-body coverings, police officers.\n  - **What is happening?**: Individuals are kneeling, and police officers are observing.\n  - **Where is this taking place?**: A city street with shops and a bus.\n  - **When is it happening (implied)?**: The image does not provide an explicit timeframe, but the clothing and bus style imply a recent event.\n  - **Why is this happening (if stated)?**: The post text implies criticism of the police response to a protest, referencing a white woman being arrested for praying outside an abortion clinic.\n  \n- **Image-Text Alignment**: The kneeling individuals and police presence in the image do not directly align with the specific claim about a white woman being arrested for praying outside an abortion clinic. The image appears to depict a protest or demonstration, not a specific arrest.\n  \n- **Emotive Language or Logical Fallacies**: The post text uses emotionally charged language (\"pathetic,\" \"fuck all,\" \"absolute joke\") and suggests a logical fallacy by implying a connection between the kneeling protesters and the arrest of a white woman, which is not substantiated by the image.\n  \n- **Timestamp Consistency Check**: The post is dated January 20, 2024, and the image appears to depict a recent protest. However, the image does not provide a specific date, and the protest could be from a recent event or a staged protest."
}