{
  "post_text": "she was right, we are all broke https://t.co/4Ee9HF2sKq",
  "image_url": "media_manipulated_class/photo_3716_0.jpg",
  "structured_response": {
    "image_description": "The image shows a person sitting in a gaming chair with a headset on. The individual is wearing a short, ruffled skirt and a strapless, patterned top. The background includes shelves with books, decorative items, and a desk with a computer setup. The room is well-lit with blue and white lighting.",
    "ocr_text": "",
    "manipulation_signs": "The image appears realistic and free of obvious signs of manipulation. The lighting, shadows, and reflections are consistent and natural.",
    "named_entities": [
      "The post mentions \"she",
      "\" but no specific names are provided. The image does not depict any identifiable individuals"
    ],
    "five_ws": {
      "who": "The person in the image",
      "what": "The person is sitting in a gaming chair, possibly engaging in a gaming session or a live stream",
      "where": "The setting appears to be a personal room or gaming station",
      "when": "The post was created on December 6, 2023, but the image itself does not provide a specific timeframe",
      "why": "The post text implies a statement about financial hardship (\"we are all broke\")"
    },
    "image_text_alignment": "The image does not visually match the claim made in the post text. The image shows a person engaged in what appears to be a gaming or streaming activity, not necessarily reflecting financial hardship.",
    "emotive_or_fallacious_language": "The post text uses emotionally charged language (\"she was right, we are all broke\"), which may imply a sense of shared frustration or disappointment. However, the image does not visually support this claim.",
    "timestamp_consistency": "The post text mentions a specific date (December 6, 2023), which is consistent with the image's timestamp."
  },
  "raw_response": "- **Image Description**: The image shows a person sitting in a gaming chair with a headset on. The individual is wearing a short, ruffled skirt and a strapless, patterned top. The background includes shelves with books, decorative items, and a desk with a computer setup. The room is well-lit with blue and white lighting.\n  \n- **OCR**: No visible text.\n\n- **Manipulation Signs**: The image appears realistic and free of obvious signs of manipulation. The lighting, shadows, and reflections are consistent and natural.\n\n- **Named Entities**: The post mentions \"she,\" but no specific names are provided. The image does not depict any identifiable individuals.\n\n- **5Ws Extraction**:\n  - **Who is involved?**: The person in the image.\n  - **What is happening?**: The person is sitting in a gaming chair, possibly engaging in a gaming session or a live stream.\n  - **Where is this taking place?**: The setting appears to be a personal room or gaming station.\n  - **When is it happening (explicit or implied)?**: The post was created on December 6, 2023, but the image itself does not provide a specific timeframe.\n  - **Why is this happening (if stated)?**: The post text implies a statement about financial hardship (\"we are all broke\").\n\n- **Image-Text Alignment**: The image does not visually match the claim made in the post text. The image shows a person engaged in what appears to be a gaming or streaming activity, not necessarily reflecting financial hardship.\n\n- **Emotive Language or Logical Fallacies**: The post text uses emotionally charged language (\"she was right, we are all broke\"), which may imply a sense of shared frustration or disappointment. However, the image does not visually support this claim.\n\n- **Timestamp Consistency Check**: The post text mentions a specific date (December 6, 2023), which is consistent with the image's timestamp."
}