{
  "post_text": "You love your Flying Space Ball Monkey religion ðŸ’€ https://t.co/ibhjogkApR",
  "image_url": "media_manipulated_class/photo_3728_0.jpg",
  "structured_response": {
    "image_description": "The image consists of two parts. The top part shows a night sky with star trails, indicating a long-exposure photograph. The text \"north pole\" is labeled on the left side, and \"South Pole?\" is labeled on the right side, suggesting a question about the positioning of the poles. The bottom part is a 3D model of Earth, showing the Teide Observatory and a line connecting the North and South Poles. The text \"How does this photo work on a globe?\" is overlaid on the image.",
    "ocr_text": "The text reads: \"What's the distance between those two points? Are both the North and South that close to each other? How is it even possible to see both at the same time on a spinning waterball Earth? ðŸ¤”\" and \"How does this photo work on a globe?\".",
    "manipulation_signs": "No obvious signs of manipulation. The image appears to be a standard photograph and a 3D model, both of which are realistic and consistent with the question posed.",
    "named_entities": [
      "Teide Observatory",
      "North Pole",
      "South Pole",
      "Earth"
    ],
    "five_ws": {
      "who": "The post does not mention any specific individuals",
      "what": "The image and text question the apparent proximity of the North and South Poles in a photograph and suggest a discrepancy with a globe model",
      "where": "The image is a composite of a night sky photograph and a 3D globe model, neither of which specifies a location",
      "when": "The image and text imply a question about a recent or current observation, as the post is dated October 3, 2023",
      "why": "The post questions the apparent proximity of the poles in a photograph, suggesting a discrepancy with a globe model"
    },
    "image_text_alignment": "The image does not visually match the claim made in the post text. The image shows a night sky and a globe model, which are not directly related to the question about the distance between the poles.",
    "emotive_or_fallacious_language": "The post uses emotionally charged language (\"waterball Earth\") and rhetorical questions to provoke thought, but does not contain logical fallacies.",
    "timestamp_consistency": "The post is dated October 3, 2023, and the image does not imply a recent or real-time event. The image is consistent with the historical reference of the post."
  },
  "raw_response": "- **Image Description**: The image consists of two parts. The top part shows a night sky with star trails, indicating a long-exposure photograph. The text \"north pole\" is labeled on the left side, and \"South Pole?\" is labeled on the right side, suggesting a question about the positioning of the poles. The bottom part is a 3D model of Earth, showing the Teide Observatory and a line connecting the North and South Poles. The text \"How does this photo work on a globe?\" is overlaid on the image.\n- **OCR**: The text reads: \"What's the distance between those two points? Are both the North and South that close to each other? How is it even possible to see both at the same time on a spinning waterball Earth? ðŸ¤”\" and \"How does this photo work on a globe?\".\n- **Manipulation Signs**: No obvious signs of manipulation. The image appears to be a standard photograph and a 3D model, both of which are realistic and consistent with the question posed.\n- **Named Entities**: Teide Observatory, North Pole, South Pole, Earth.\n- **5Ws Extraction**:\n  - **Who is involved?**: The post does not mention any specific individuals.\n  - **What is happening?**: The image and text question the apparent proximity of the North and South Poles in a photograph and suggest a discrepancy with a globe model.\n  - **Where is this taking place?**: The image is a composite of a night sky photograph and a 3D globe model, neither of which specifies a location.\n  - **When is it happening (explicit or implied)?**: The image and text imply a question about a recent or current observation, as the post is dated October 3, 2023.\n  - **Why is this happening (if stated)?**: The post questions the apparent proximity of the poles in a photograph, suggesting a discrepancy with a globe model.\n- **Image-Text Alignment**: The image does not visually match the claim made in the post text. The image shows a night sky and a globe model, which are not directly related to the question about the distance between the poles.\n- **Emotive Language or Logical Fallacies**: The post uses emotionally charged language (\"waterball Earth\") and rhetorical questions to provoke thought, but does not contain logical fallacies.\n- **Timestamp Consistency Check**: The post is dated October 3, 2023, and the image does not imply a recent or real-time event. The image is consistent with the historical reference of the post."
}