{
  "post_text": "#reasearchflatearth #flatearth https://t.co/Jcg7mfDfrL",
  "image_url": "media_manipulated_class/photo_3729_0.jpg",
  "structured_response": {
    "image_description": "The image is a collage of three panels showing astronauts in space. The top panel includes the text \"MORE GARBAGE FROM NASA.\" The middle and bottom panels show the same astronaut, but the reflections in the helmet's visor depict different scenes: a spacewalk, a view of Earth, and a space station, respectively.",
    "ocr_text": "The text reads:\n  - \"MORE GARBAGE FROM NASA.\"\n  - \"3 DIFFERENT IMAGES, THE SAME\"\n  - \"REFLECTION IN THE HELMET VISOR.\"",
    "manipulation_signs": "No obvious signs of manipulation. The reflections in the helmet's visor appear consistent with the astronaut's position in space, and the lighting and shadows are realistic.",
    "named_entities": [
      "NASA",
      "astronaut",
      "spacewalk",
      "Earth",
      "space station"
    ],
    "five_ws": {
      "who": "Astronauts",
      "what": "The astronaut is in space, and the reflections in the helmet's visor show different scenes",
      "where": "Space",
      "when": "Implied to be a recent or real-time event, as the astronaut is in space",
      "why": "The post suggests that the reflections in the helmet's visor depict different images, implying a conspiracy theory about NASA's photos"
    },
    "image_text_alignment": "The image visually supports the claim made in the post text, as the reflections in the helmet's visor depict different scenes.",
    "emotive_or_fallacious_language": "The post uses emotive language (\"MORE GARBAGE FROM NASA\") and suggests a conspiracy theory, which is a logical fallacy.",
    "timestamp_consistency": "The post is dated 18 January 2024, and the image appears consistent with that historical reference."
  },
  "raw_response": "- **Image Description**: The image is a collage of three panels showing astronauts in space. The top panel includes the text \"MORE GARBAGE FROM NASA.\" The middle and bottom panels show the same astronaut, but the reflections in the helmet's visor depict different scenes: a spacewalk, a view of Earth, and a space station, respectively.\n- **OCR**: The text reads:\n  - \"MORE GARBAGE FROM NASA.\"\n  - \"3 DIFFERENT IMAGES, THE SAME\"\n  - \"REFLECTION IN THE HELMET VISOR.\"\n- **Manipulation Signs**: No obvious signs of manipulation. The reflections in the helmet's visor appear consistent with the astronaut's position in space, and the lighting and shadows are realistic.\n- **Named Entities**: NASA, astronaut, spacewalk, Earth, space station.\n- **5Ws Extraction**:\n  - **Who is involved?**: Astronauts.\n  - **What is happening?**: The astronaut is in space, and the reflections in the helmet's visor show different scenes.\n  - **Where is this taking place?**: Space.\n  - **When is it happening (explicit or implied)?**: Implied to be a recent or real-time event, as the astronaut is in space.\n  - **Why is this happening (if stated)?**: The post suggests that the reflections in the helmet's visor depict different images, implying a conspiracy theory about NASA's photos.\n- **Image-Text Alignment**: The image visually supports the claim made in the post text, as the reflections in the helmet's visor depict different scenes.\n- **Emotive Language or Logical Fallacies**: The post uses emotive language (\"MORE GARBAGE FROM NASA\") and suggests a conspiracy theory, which is a logical fallacy.\n- **Timestamp Consistency Check**: The post is dated 18 January 2024, and the image appears consistent with that historical reference."
}