{
  "post_text": "Liang Wenfeng, founder of DeepSeek, is driving AI innovation with models like DeepSeek-V3, surpassing ChatGPT and gaining global recognition.\n\nDiscover more about Liang Wenfeng on our website: https://t.co/kRxAGGEa7o https://t.co/hY5oeSQ7UU",
  "image_url": "media_miscaptioned_class/photo_431_0.jpg",
  "structured_response": {
    "image_description": "The image shows a man standing confidently with his arms crossed. He is wearing a dark blue pinstripe suit, a white shirt, and a dark tie. He has a wristwatch on his left wrist. The background is a chalkboard-like texture with mathematical equations and diagrams faintly visible.",
    "ocr_text": "The text reads \"ENGINEER OF THE DAY\", \"LIANG WENFENG (1985) / CHINA\", and \"REVOLUTIONIZING TECH WITH DEEPSEEK, HE'S A PIONEERING AI ENTREPRENEUR AND ELECTRONIC INFORMATION ENGINEER.\" There is also a logo in the top right corner that appears to say \"IE\".",
    "manipulation_signs": "No obvious signs of manipulation. The image appears to be a professionally taken photograph with a realistic background.",
    "named_entities": [
      "Liang Wenfeng",
      "DeepSeek",
      "ChatGPT",
      "China",
      "Engineer of the Day",
      "IE"
    ],
    "five_ws": {
      "who": "Liang Wenfeng",
      "what": "Revolutionizing tech with DeepSeek",
      "where": "The image does not specify a location",
      "when": "The image does not specify a time",
      "why": "The image implies that Liang Wenfeng is revolutionizing tech with DeepSeek"
    },
    "image_text_alignment": "The image visually matches the claim made in the post text. The man in the image appears to be the same person mentioned in the text.",
    "emotive_or_fallacious_language": "The text does not contain emotionally charged language or logical fallacies.",
    "timestamp_consistency": "The post was created on January 29, 2025, and the image appears consistent with that date."
  },
  "raw_response": "- **Image Description**: The image shows a man standing confidently with his arms crossed. He is wearing a dark blue pinstripe suit, a white shirt, and a dark tie. He has a wristwatch on his left wrist. The background is a chalkboard-like texture with mathematical equations and diagrams faintly visible.\n- **OCR**: The text reads \"ENGINEER OF THE DAY\", \"LIANG WENFENG (1985) / CHINA\", and \"REVOLUTIONIZING TECH WITH DEEPSEEK, HE'S A PIONEERING AI ENTREPRENEUR AND ELECTRONIC INFORMATION ENGINEER.\" There is also a logo in the top right corner that appears to say \"IE\".\n- **Manipulation Signs**: No obvious signs of manipulation. The image appears to be a professionally taken photograph with a realistic background.\n- **Named Entities**: Liang Wenfeng, DeepSeek, ChatGPT, China, Engineer of the Day, IE.\n- **5Ws Extraction**:\n  - **Who is involved?**: Liang Wenfeng.\n  - **What is happening?**: Revolutionizing tech with DeepSeek.\n  - **Where is this taking place?**: The image does not specify a location.\n  - **When is it happening (explicit or implied)?**: The image does not specify a time.\n  - **Why is this happening (if stated)?**: The image implies that Liang Wenfeng is revolutionizing tech with DeepSeek.\n- **Image-Text Alignment**: The image visually matches the claim made in the post text. The man in the image appears to be the same person mentioned in the text.\n- **Emotive Language or Logical Fallacies**: The text does not contain emotionally charged language or logical fallacies.\n- **Timestamp Consistency Check**: The post was created on January 29, 2025, and the image appears consistent with that date."
}