{
  "post_text": "HOLY SH*T\n\nI thought people were just posting early pictures… BUT HERE YOU CAN SEE PEOPLE SPEAKING AND THE DNC ARENA IS ALMOST EMPTY ⚠️\n\nWe are witnessing the final months of the Democrat party soon it won’t exist anymore. https://t.co/EBJe3DIINo",
  "image_url": "media_miscaptioned_class/photo_1869_0.jpg",
  "structured_response": {
    "image_description": "The image shows a large indoor arena, presumably during a political convention, specifically the Democratic National Convention (DNC) 2024, as indicated by the signage. The arena is mostly occupied with attendees seated in rows, and there are a few people standing and walking around. The stage is elevated, and there is a large screen displaying a speaker at a podium. The setting appears to be well-lit, typical of a large-scale event. The audience is diverse, with individuals of varying appearances and attire.",
    "ocr_text": "The OCR text reads \"Democratic National Convention AUGUST 19-22 CHICAGO\" and \"DNC2024\". There is also a red arrow pointing to a specific area on the stage, highlighting a person standing there.",
    "manipulation_signs": "No obvious signs of manipulation are present. The lighting, shadows, and details in the image appear consistent and natural. The image does not show any distorted or unnatural elements.",
    "named_entities": [
      "Democratic National Convention (DNC)",
      "2024",
      "August 19-22",
      "Chicago"
    ],
    "five_ws": {
      "who": "Attendees, organizers, and speakers at the DNC",
      "what": "A political convention is taking place, with a speaker addressing the audience",
      "where": "Chicago, at the DNC venue",
      "when": "The event is happening on August 19-22, 2024",
      "why": "The text implies a political context but does not explicitly state the reason for the event"
    },
    "image_text_alignment": "The image shows a large crowd and a speaker on stage, which aligns with the text stating that people are speaking and the DNC arena is almost empty. However, the text implies a much smaller crowd than what is visually depicted in the image.",
    "emotive_or_fallacious_language": "The post uses emotionally charged language (\"HOLY SH*T\") and exaggerations (\"it won’t exist anymore\"), which may be intended to provoke a reaction but do not align with the factual observation of the image.",
    "timestamp_consistency": "The post text mentions the DNC 2024 event, which took place in August 2024. The image depicts the event as it was occurring, not a manipulated or past event. Therefore, there is no temporal inconsistency."
  },
  "raw_response": "- **Image Description**: The image shows a large indoor arena, presumably during a political convention, specifically the Democratic National Convention (DNC) 2024, as indicated by the signage. The arena is mostly occupied with attendees seated in rows, and there are a few people standing and walking around. The stage is elevated, and there is a large screen displaying a speaker at a podium. The setting appears to be well-lit, typical of a large-scale event. The audience is diverse, with individuals of varying appearances and attire.\n  \n- **OCR**: The OCR text reads \"Democratic National Convention AUGUST 19-22 CHICAGO\" and \"DNC2024\". There is also a red arrow pointing to a specific area on the stage, highlighting a person standing there.\n\n- **Manipulation Signs**: No obvious signs of manipulation are present. The lighting, shadows, and details in the image appear consistent and natural. The image does not show any distorted or unnatural elements.\n\n- **Named Entities**: Democratic National Convention (DNC), 2024, August 19-22, Chicago.\n\n- **5Ws Extraction**:\n  - **Who is involved?**: Attendees, organizers, and speakers at the DNC.\n  - **What is happening?**: A political convention is taking place, with a speaker addressing the audience.\n  - **Where is this taking place?**: Chicago, at the DNC venue.\n  - **When is it happening (explicit or implied)?**: The event is happening on August 19-22, 2024.\n  - **Why is this happening (if stated)?**: The text implies a political context but does not explicitly state the reason for the event.\n\n- **Image-Text Alignment**: The image shows a large crowd and a speaker on stage, which aligns with the text stating that people are speaking and the DNC arena is almost empty. However, the text implies a much smaller crowd than what is visually depicted in the image.\n\n- **Emotive Language or Logical Fallacies**: The post uses emotionally charged language (\"HOLY SH*T\") and exaggerations (\"it won’t exist anymore\"), which may be intended to provoke a reaction but do not align with the factual observation of the image.\n\n- **Timestamp Consistency Check**: The post text mentions the DNC 2024 event, which took place in August 2024. The image depicts the event as it was occurring, not a manipulated or past event. Therefore, there is no temporal inconsistency."
}