{
  "post_text": "Abandoned Dunalastair Castle,Scotland. https://t.co/icqdBe4i0I",
  "image_url": "media_miscaptioned_class/photo_1914_0.jpg",
  "structured_response": {
    "image_description": "The image depicts a large, historical-looking structure built into the side of a steep cliff. The architecture appears to be medieval or ancient, with multiple levels and arched windows. The building is surrounded by rugged, rocky terrain with sparse vegetation. The structure seems to be in a remote and isolated location.",
    "ocr_text": "",
    "manipulation_signs": "The image appears to be a photograph of a real-world structure, likely a monastery or fortress, rather than an AI-generated or heavily manipulated image. The lighting, shadows, and details in the stone and vegetation are consistent with natural conditions. There are no obvious signs of manipulation.",
    "named_entities": [
      "Dunalastair Castle",
      "Scotland"
    ],
    "five_ws": {
      "who": "The image does not specify any individuals",
      "what": "The image shows the structure, implying it is abandoned or in ruins",
      "where": "Scotland, specifically at Dunalastair Castle",
      "when": "The post suggests the image depicts an abandoned state, implying it is not a recent construction or renovation",
      "why": "The post does not provide a reason for the abandonment"
    },
    "image_text_alignment": "The image visually matches the claim made in the post text, as it depicts a structure in a state of abandonment.",
    "emotive_or_fallacious_language": "The post does not contain emotionally charged language or logical fallacies.",
    "timestamp_consistency": "The post was created on November 3, 2023, and the image depicts an abandoned state, which is consistent with the post's claim."
  },
  "raw_response": "- **Image Description**: The image depicts a large, historical-looking structure built into the side of a steep cliff. The architecture appears to be medieval or ancient, with multiple levels and arched windows. The building is surrounded by rugged, rocky terrain with sparse vegetation. The structure seems to be in a remote and isolated location.\n- **OCR**: No visible text.\n- **Manipulation Signs**: The image appears to be a photograph of a real-world structure, likely a monastery or fortress, rather than an AI-generated or heavily manipulated image. The lighting, shadows, and details in the stone and vegetation are consistent with natural conditions. There are no obvious signs of manipulation.\n- **Named Entities**: Dunalastair Castle, Scotland\n- **5Ws Extraction**:\n  - **Who is involved?**: The image does not specify any individuals.\n  - **What is happening?**: The image shows the structure, implying it is abandoned or in ruins.\n  - **Where is this taking place?**: Scotland, specifically at Dunalastair Castle.\n  - **When is it happening (explicit or implied)?**: The post suggests the image depicts an abandoned state, implying it is not a recent construction or renovation.\n  - **Why is this happening (if stated)?**: The post does not provide a reason for the abandonment.\n- **Image-Text Alignment**: The image visually matches the claim made in the post text, as it depicts a structure in a state of abandonment.\n- **Emotive Language or Logical Fallacies**: The post does not contain emotionally charged language or logical fallacies.\n- **Timestamp Consistency Check**: The post was created on November 3, 2023, and the image depicts an abandoned state, which is consistent with the post's claim."
}