{
  "post_text": "Lana Del Rey has just posted this picture on ig with the following caption:\n\nIf you see a bulge in a conservative woman’s pants, it’s a gun.\n\nIf you see a bulge in a liberal woman’s pants, it’s a penis. https://t.co/nltQi7FED3",
  "image_url": "media_miscaptioned_class/photo_1922_0.jpg",
  "structured_response": {
    "image_description": "The image shows a woman taking a selfie in a mirror. She is wearing a white, lace-like, off-the-shoulder dress with a large white bow tied at the neckline. She is holding a smartphone in her left hand, taking the photo, and her right hand is holding a black object, possibly a phone case or small bag. The background includes a bed with white bedding, a television, a chair draped with a red cloth, and a framed picture on the wall. The room appears to be a hotel or apartment room.",
    "ocr_text": "",
    "manipulation_signs": "The image does not display any obvious signs of AI-generated, manipulated, or edited content. The lighting is consistent, and the shadows and reflections appear natural. The hands and face of the woman are well-defined, and there are no distorted or unnatural elements.",
    "named_entities": [
      "Lana Del Rey",
      "gun",
      "penis",
      "conservative",
      "liberal",
      "Instagram (IG)"
    ],
    "five_ws": {
      "who": "Lana Del Rey",
      "what": "Lana Del Rey is taking a selfie in a mirror",
      "where": "In a hotel or apartment room",
      "when": "The post was created on 07 February 2024",
      "why": "The post text implies that the image is related to a statement about seeing a bulge in women's pants, which is not directly related to the image itself"
    },
    "image_text_alignment": "The image does not visually match the claim made in the post text. The image shows Lana Del Rey taking a selfie, which is unrelated to the statement about seeing bulges in women's pants.",
    "emotive_or_fallacious_language": "The post text contains emotionally charged and potentially misleading language, suggesting biases about political affiliations based on physical appearance. This is a form of hate speech and logical fallacy.",
    "timestamp_consistency": "The post text mentions a date (07 February 2024), and the image appears to be from that date. Therefore, there is no inconsistency in the timestamp."
  },
  "raw_response": "- **Image Description**: The image shows a woman taking a selfie in a mirror. She is wearing a white, lace-like, off-the-shoulder dress with a large white bow tied at the neckline. She is holding a smartphone in her left hand, taking the photo, and her right hand is holding a black object, possibly a phone case or small bag. The background includes a bed with white bedding, a television, a chair draped with a red cloth, and a framed picture on the wall. The room appears to be a hotel or apartment room.\n- **OCR**: No visible text.\n- **Manipulation Signs**: The image does not display any obvious signs of AI-generated, manipulated, or edited content. The lighting is consistent, and the shadows and reflections appear natural. The hands and face of the woman are well-defined, and there are no distorted or unnatural elements.\n- **Named Entities**: Lana Del Rey, gun, penis, conservative, liberal, Instagram (IG).\n- **5Ws Extraction**:\n  - **Who is involved?**: Lana Del Rey.\n  - **What is happening?**: Lana Del Rey is taking a selfie in a mirror.\n  - **Where is this taking place?**: In a hotel or apartment room.\n  - **When is it happening (explicit or implied)?**: The post was created on 07 February 2024.\n  - **Why is this happening (if stated)?**: The post text implies that the image is related to a statement about seeing a bulge in women's pants, which is not directly related to the image itself.\n- **Image-Text Alignment**: The image does not visually match the claim made in the post text. The image shows Lana Del Rey taking a selfie, which is unrelated to the statement about seeing bulges in women's pants.\n- **Emotive Language or Logical Fallacies**: The post text contains emotionally charged and potentially misleading language, suggesting biases about political affiliations based on physical appearance. This is a form of hate speech and logical fallacy.\n- **Timestamp Consistency Check**: The post text mentions a date (07 February 2024), and the image appears to be from that date. Therefore, there is no inconsistency in the timestamp."
}